[
  {
    "id": "ucr-censo-tic-municipal-2026",
    "titulo": {
      "es": "Censo TIC 2026: uso de IA en gobiernos locales participantes",
      "en": "2026 ICT Census: AI use in participating local governments"
    },
    "fuente": "UCR / Centro de Investigación Observatorio del Desarrollo",
    "url": "https://www.ucr.ac.cr/noticias/2026/10/15/voz-experta-las-municipalidades-en-la-era-de-la-inteligencia-artificial-ia.html",
    "tipo": { "es": "Estadística municipal", "en": "Municipal statistics" },
    "tipoFuente": "academica",
    "nota": {
      "es": "Voz experta comunica resultados de 43 participantes: 41 municipalidades y 2 concejos municipales de distrito. Un 88,4 % reporta funcionarios que usan IA; 4 realizaron capacitación y 15 la desarrollan; 67,4 % no tiene lineamientos ni los elabora y 1 reporta tenerlos. Es autorreporte, no una estimación nacional ni cumplimiento del IFAM. No se recuperó la metodología completa.",
      "en": "An expert article reports results from 43 participants: 41 municipalities and 2 district municipal councils. Some 88.4% report staff using AI; 4 completed training and 15 are developing it; 67.4% lack guidelines and are not developing them, while 1 reports having them. These are self-reports, not a national estimate or IFAM fulfillment. The full methodology was not recovered."
    }
  },
  {
    "id": "decreto-45961-msp",
    "titulo": {
      "es": "Decreto 45961-MSP: videoprotección, IA y reconocimiento biométrico",
      "en": "Decree 45961-MSP: video protection, AI and biometric recognition"
    },
    "fuente": "Imprenta Nacional, Alcance 138 a La Gaceta 194, 14/10/2026",
    "url": "https://www.imprentanacional.go.cr/pub/2026/10/14/ALCA138_14_10_2026.pdf",
    "tipo": { "es": "Regulación sectorial", "en": "Sectoral regulation" },
    "tipoFuente": "primaria-oficial",
    "nota": {
      "es": "Texto oficial, páginas 101–113. El artículo 25 contempla análisis con IA y exige valoración humana para decisiones que afecten derechos; el 26 condiciona el reconocimiento biométrico y restringe el tratamiento indiscriminado, salvo habilitación legal expresa y garantías. Los transitorios fijan un mes para manuales y un año para protocolos desde publicación. No acredita despliegue ni cumplimiento de esos plazos.",
      "en": "Official text, pages 101–113. Article 25 provides for AI analysis and requires human assessment for decisions affecting rights; Article 26 conditions biometric recognition and restricts indiscriminate processing unless expressly authorized by law with safeguards. Transitional provisions set one month for manuals and one year for protocols from publication. Deployment and compliance with those deadlines are not established."
    }
  },
  {
    "id": "decreto-44507-micitt",
    "titulo": {
      "es": "Decreto 44507-MICITT, Código Nacional de Tecnologías Digitales",
      "en": "Decree 44507-MICITT, National Code of Digital Technologies"
    },
    "fuente": "PGR-SCIJ",
    "url": "https://pgrweb.go.cr/scij/Busqueda/Normativa/Normas/nrm_texto_completo.aspx?nValor1=1&nValor2=102229&nValor3=141218&param1=NRTC&strTipM=TC",
    "tipo": { "es": "Marco normativo", "en": "Regulatory framework" },
    "tipoFuente": "primaria-oficial"
  },
  {
    "id": "cntd-vigente",
    "titulo": {
      "es": "CNTD vigente, capítulos I al XIX",
      "en": "Current CNTD, Chapters I through XIX"
    },
    "fuente": "MICITT",
    "url": "https://www.micitt.go.cr/node/625",
    "tipo": { "es": "Marco normativo", "en": "Regulatory framework" },
    "tipoFuente": "primaria-oficial"
  },
  {
    "id": "enia-2024-2027",
    "titulo": {
      "es": "Estrategia Nacional de IA (ENIA) 2024-2027",
      "en": "National AI Strategy (ENIA) 2024-2027"
    },
    "fuente": "MICITT",
    "url": "https://www.micitt.go.cr/el-sector-informa/micitt-presento-estrategia-nacional-de-inteligencia-artificial-enia",
    "tipo": { "es": "Política pública", "en": "Public policy" },
    "tipoFuente": "primaria-oficial"
  },
  {
    "id": "plan-accion-enia-2025",
    "titulo": {
      "es": "Plan de Acción de la ENIA, versión del 11 de agosto de 2025",
      "en": "ENIA Action Plan, August 11, 2025 version"
    },
    "fuente": "MICITT",
    "url": "https://www.micitt.go.cr/sites/default/files/2025-10/Plan%20de%20Acci%C3%B3n%20ENIA%20-%20Versi%C3%B3n%2011%20agosto%202025%20Versi%C3%B3n%20Publicaci%C3%B3n.pdf",
    "tipo": { "es": "Implementación estratégica", "en": "Strategic implementation" },
    "tipoFuente": "primaria-oficial"
  },
  {
    "id": "principios-ocde-ia",
    "titulo": {
      "es": "Principios de la OCDE sobre Inteligencia Artificial",
      "en": "OECD Principles on Artificial Intelligence"
    },
    "fuente": "OCDE",
    "url": "https://oecd.ai/en/ai-principles",
    "tipo": { "es": "Referencia internacional", "en": "International reference" },
    "tipoFuente": "multilateral"
  },
  {
    "id": "dialogo-ai4lac-2026",
    "titulo": {
      "es": "Diálogo Regional AI4LAC sobre Gobernanza de IA",
      "en": "AI4LAC Regional Dialogue on AI Governance"
    },
    "fuente": "MICITT / ONU Costa Rica / CEPAL",
    "url": "https://www.micitt.go.cr/el-sector-informa/costa-rica-lidera-dialogo-regional-sobre-inteligencia-artificial",
    "tipo": { "es": "Hito regional / Gobernanza IA", "en": "Regional milestone / AI governance" },
    "tipoFuente": "primaria-oficial",
    "nota": {
      "es": "Costa Rica lidera el proceso regional AI4LAC convocado en mayo de 2026 para consolidar prioridades de gobernanza de IA de América Latina y el Caribe rumbo al Diálogo Global de IA en Suiza.",
      "en": "Costa Rica leads the AI4LAC regional process convened in May 2026 to consolidate Latin American and Caribbean AI governance priorities ahead of the Global AI Dialogue in Switzerland."
    }
  },
  {
    "id": "aila-costa-rica",
    "titulo": {
      "es": "AILA: Evaluación del Panorama de la Inteligencia Artificial",
      "en": "AILA: Artificial Intelligence Landscape Assessment"
    },
    "fuente": "PNUD / MICITT",
    "url": "https://pnud-conocimiento.cr/wp-content/uploads/2026/09/AILA_2026_MICITT_digital-1.pdf",
    "tipo": { "es": "Evaluación diagnóstica", "en": "Diagnostic assessment" },
    "tipoFuente": "multilateral"
  },
  {
    "id": "disruptia-2026",
    "titulo": {
      "es": "DisruptIA 2026: Decisión empresarial aumentada con IA",
      "en": "DisruptIA 2026: AI-Augmented Business Decision Making"
    },
    "fuente": "MICITT / INA",
    "url": "https://www.innovar.pro",
    "tipo": { "es": "Programa de formación", "en": "Training program" },
    "tipoFuente": "otra-secundaria"
  },
  {
    "id": "lineamientos-ia-generativa-pj",
    "titulo": {
      "es": "Lineamientos Básicos para el uso de IA Generativa en el Poder Judicial",
      "en": "Basic Guidelines for Generative AI use in the Judicial Branch"
    },
    "fuente": "Poder Judicial",
    "url": "https://transparencia.poder-judicial.go.cr/index.php/declaracion-de-uso-de-inteligencia-artificial",
    "tipo": { "es": "Marco institucional", "en": "Institutional framework" },
    "tipoFuente": "primaria-oficial"
  },
  {
    "id": "programa-lidia-ccss",
    "titulo": {
      "es": "Programa LIDIA, IA predictiva en salud",
      "en": "LIDIA Program, Predictive AI in healthcare"
    },
    "fuente": "CCSS / Teletica",
    "url": "https://www.teletica.com/salud/lidia-el-programa-de-inteligencia-artificial-que-crece-en-la-ccss-en-medio-de-un-dilema-etico_376322",
    "tipo": { "es": "Cobertura", "en": "Coverage" },
    "tipoFuente": "prensa"
  },
  {
    "id": "reglamento-proteccion-datos-pj",
    "titulo": {
      "es": "Reglamento de Protección de Datos del Poder Judicial",
      "en": "Judicial Branch Data Protection Regulation"
    },
    "fuente": "Poder Judicial",
    "url": "https://cij.poder-judicial.go.cr/images/ProteccionDatos/REGLAMENTO_PROTECCIN_DE_DATOS-PODER_JUDICIAL.pdf",
    "tipo": { "es": "Reglamento", "en": "Regulation" },
    "tipoFuente": "primaria-oficial"
  },
  {
    "id": "ilia-2025",
    "titulo": {
      "es": "Índice Latinoamericano de Inteligencia Artificial 2025",
      "en": "Latin American Artificial Intelligence Index 2025"
    },
    "fuente": "CENIA / CEPAL",
    "url": "https://indicelatam.cl/wp-content/uploads/2025/10/Documento_ILIA_2025.pdf",
    "tipo": { "es": "Indicador regional", "en": "Regional indicator" },
    "tipoFuente": "multilateral"
  },
  {
    "id": "gtmi-2025",
    "titulo": {
      "es": "Índice de Madurez GovTech 2025 (GTMI)",
      "en": "GovTech Maturity Index 2025 (GTMI)"
    },
    "fuente": "Banco Mundial",
    "url": "https://www.worldbank.org/en/programs/govtech/gtmi-2025-update",
    "tipo": { "es": "Indicador internacional", "en": "International indicator" },
    "tipoFuente": "multilateral",
    "nota": {
      "es": "El GTMI describe la madurez de la transformación digital del sector público. No es un ranking de preparación para IA.",
      "en": "The GTMI describes public-sector digital-transformation maturity. It is not an AI-readiness ranking."
    }
  },
  {
    "id": "uruguay-decreto-sandboxes",
    "titulo": {
      "es": "Decreto 276/025, sandboxes regulatorios de IA en Uruguay",
      "en": "Decree 276/025, AI regulatory sandboxes in Uruguay"
    },
    "fuente": "IMPO",
    "url": "https://www.impo.com.uy/bases/decretos/276-2025",
    "tipo": { "es": "Gobernanza regional", "en": "Regional governance" },
    "tipoFuente": "primaria-oficial"
  },
  {
    "id": "uruguay-presidencia-sandboxes",
    "titulo": {
      "es": "Decreto 276/025, comunicado oficial de Presidencia de Uruguay",
      "en": "Decree 276/025, official communication from Uruguay's Presidency"
    },
    "fuente": "Presidencia Uruguay",
    "url": "https://www.gub.uy/presidencia/institucional/normativa/decreto-n-276025-se-establece-esquema-gobernanza-para-creacion-gestion",
    "tipo": { "es": "Gobernanza regional", "en": "Regional governance" },
    "tipoFuente": "primaria-oficial"
  },
  {